[
  {
    "name": "PATCH retries on 503 (idempotent)",
    "description": "PATCH operations are naturally idempotent and should be retried",
    "operation": "UpdateBoard",
    "method": "PATCH",
    "path": "/{accountId}/boards/{boardId}",
    "pathParams": { "accountId": "999", "boardId": 1 },
    "requestBody": { "name": "Updated" },
    "mockResponses": [
      {
        "status": 503,
        "headers": { "Content-Type": "application/json" },
        "body": { "error": "Service unavailable" }
      },
      {
        "status": 200,
        "headers": { "Content-Type": "application/json" },
        "body": { "id": "1", "name": "Updated", "all_access": true, "created_at": "2026-01-01T00:00:00Z", "url": "https://fizzy.do/999/boards/1" }
      }
    ],
    "assertions": [
      { "type": "requestCount", "expected": 2 },
      { "type": "noError" }
    ],
    "tags": ["idempotency"]
  },
  {
    "name": "DELETE retries on 503 (idempotent)",
    "description": "DELETE operations are naturally idempotent and should be retried",
    "operation": "DeleteBoard",
    "method": "DELETE",
    "path": "/{accountId}/boards/{boardId}",
    "pathParams": { "accountId": "999", "boardId": 1 },
    "mockResponses": [
      {
        "status": 503,
        "headers": { "Content-Type": "application/json" },
        "body": { "error": "Service unavailable" }
      },
      {
        "status": 204,
        "headers": {},
        "body": null
      }
    ],
    "assertions": [
      { "type": "requestCount", "expected": 2 },
      { "type": "noError" }
    ],
    "tags": ["idempotency"]
  },
  {
    "name": "POST create does NOT retry on 503",
    "description": "POST create operations are not idempotent and must not be retried",
    "operation": "CreateCard",
    "method": "POST",
    "path": "/{accountId}/cards.json",
    "pathParams": { "accountId": "999" },
    "requestBody": { "title": "Test Card", "board_id": "1" },
    "mockResponses": [
      {
        "status": 503,
        "headers": { "Content-Type": "application/json" },
        "body": { "error": "Service unavailable" }
      }
    ],
    "assertions": [
      { "type": "requestCount", "expected": 1 },
      { "type": "statusCode", "expected": 503 },
      { "type": "requestBodyField", "expected": "board_id" }
    ],
    "tags": ["idempotency"]
  },
  {
    "name": "DestroySession DELETE does NOT retry (contract exception)",
    "description": "DestroySession is a one-time operation — even though it is DELETE, it must not be retried (RD-9b)",
    "operation": "DestroySession",
    "method": "DELETE",
    "path": "/session.json",
    "mockResponses": [
      {
        "status": 503,
        "headers": { "Content-Type": "application/json" },
        "body": { "error": "Service unavailable" }
      }
    ],
    "assertions": [
      { "type": "requestCount", "expected": 1 },
      { "type": "statusCode", "expected": 503 }
    ],
    "tags": ["idempotency", "sessions"]
  },
  {
    "name": "MarkCardRead POST retries on 503 (naturally idempotent)",
    "description": "MarkCardRead is a naturally idempotent POST and should be retried",
    "operation": "MarkCardRead",
    "method": "POST",
    "path": "/{accountId}/cards/{cardNumber}/reading.json",
    "pathParams": { "accountId": "999", "cardNumber": 123 },
    "mockResponses": [
      {
        "status": 503,
        "headers": { "Content-Type": "application/json" },
        "body": { "error": "Service unavailable" }
      },
      {
        "status": 200,
        "headers": { "Content-Type": "application/json" },
        "body": null
      }
    ],
    "assertions": [
      { "type": "requestCount", "expected": 2 },
      { "type": "noError" }
    ],
    "tags": ["idempotency"]
  },
  {
    "name": "MoveColumnLeft POST does NOT retry on 503 (each call moves the column again)",
    "description": "MoveColumnLeft swaps the column with its neighbor on every call, so a retry would move it twice; it must not be retried",
    "operation": "MoveColumnLeft",
    "method": "POST",
    "path": "/{accountId}/columns/{columnId}/left_position.json",
    "pathParams": { "accountId": "999", "columnId": 10 },
    "mockResponses": [
      {
        "status": 503,
        "headers": { "Content-Type": "application/json" },
        "body": { "error": "Service unavailable" }
      }
    ],
    "assertions": [
      { "type": "requestCount", "expected": 1 },
      { "type": "statusCode", "expected": 503 }
    ],
    "tags": ["idempotency"]
  },
  {
    "name": "MoveColumnRight POST does NOT retry on 503 (each call moves the column again)",
    "description": "MoveColumnRight swaps the column with its neighbor on every call, so a retry would move it twice; it must not be retried",
    "operation": "MoveColumnRight",
    "method": "POST",
    "path": "/{accountId}/columns/{columnId}/right_position.json",
    "pathParams": { "accountId": "999", "columnId": 10 },
    "mockResponses": [
      {
        "status": 503,
        "headers": { "Content-Type": "application/json" },
        "body": { "error": "Service unavailable" }
      }
    ],
    "assertions": [
      { "type": "requestCount", "expected": 1 },
      { "type": "statusCode", "expected": 503 }
    ],
    "tags": ["idempotency"]
  },
  {
    "name": "TriageCard POST does NOT retry on 503 (records an event per call)",
    "description": "TriageCard records a triaged event on every call, so a retry would record it twice; it must not be retried",
    "operation": "TriageCard",
    "method": "POST",
    "path": "/{accountId}/cards/{cardNumber}/triage.json",
    "pathParams": { "accountId": "999", "cardNumber": 42 },
    "requestBody": { "column_id": "7" },
    "mockResponses": [
      {
        "status": 503,
        "headers": { "Content-Type": "application/json" },
        "body": { "error": "Service unavailable" }
      }
    ],
    "assertions": [
      { "type": "requestCount", "expected": 1 },
      { "type": "statusCode", "expected": 503 }
    ],
    "tags": ["idempotency"]
  },
  {
    "name": "UnTriageCard DELETE does NOT retry on 503 (records an event per call)",
    "description": "UnTriageCard records a sent-back-to-triage event on every call, so it is not idempotent; even though it is DELETE, it must not be retried",
    "operation": "UnTriageCard",
    "method": "DELETE",
    "path": "/{accountId}/cards/{cardNumber}/triage.json",
    "pathParams": { "accountId": "999", "cardNumber": 42 },
    "mockResponses": [
      {
        "status": 503,
        "headers": { "Content-Type": "application/json" },
        "body": { "error": "Service unavailable" }
      }
    ],
    "assertions": [
      { "type": "requestCount", "expected": 1 },
      { "type": "statusCode", "expected": 503 }
    ],
    "tags": ["idempotency"]
  },
  {
    "name": "PostponeCard POST does NOT retry on 503 (records an event per call)",
    "description": "PostponeCard records a postponed event on every call, even for a card already postponed, so a retry would record it twice; it must not be retried",
    "operation": "PostponeCard",
    "method": "POST",
    "path": "/{accountId}/cards/{cardNumber}/not_now.json",
    "pathParams": { "accountId": "999", "cardNumber": 42 },
    "mockResponses": [
      {
        "status": 503,
        "headers": { "Content-Type": "application/json" },
        "body": { "error": "Service unavailable" }
      }
    ],
    "assertions": [
      { "type": "requestCount", "expected": 1 },
      { "type": "statusCode", "expected": 503 }
    ],
    "tags": ["idempotency"]
  },
  {
    "name": "UnpinCard DELETE does NOT retry on 503 (a repeat fails)",
    "description": "UnpinCard fails once the card is no longer pinned, so it is not idempotent; even though it is DELETE, it must not be retried",
    "operation": "UnpinCard",
    "method": "DELETE",
    "path": "/{accountId}/cards/{cardNumber}/pin.json",
    "pathParams": { "accountId": "999", "cardNumber": 42 },
    "mockResponses": [
      {
        "status": 503,
        "headers": { "Content-Type": "application/json" },
        "body": { "error": "Service unavailable" }
      }
    ],
    "assertions": [
      { "type": "requestCount", "expected": 1 },
      { "type": "statusCode", "expected": 503 }
    ],
    "tags": ["idempotency"]
  },
  {
    "name": "ResetJoinCode DELETE does NOT retry on 503 (each call mints a new code)",
    "description": "ResetJoinCode replaces the join code on every call, so a retry would invalidate the code the first call issued; even though it is DELETE, it must not be retried",
    "operation": "ResetJoinCode",
    "method": "DELETE",
    "path": "/{accountId}/account/join_code.json",
    "pathParams": { "accountId": "999" },
    "mockResponses": [
      {
        "status": 503,
        "headers": { "Content-Type": "application/json" },
        "body": { "error": "Service unavailable" }
      }
    ],
    "assertions": [
      { "type": "requestCount", "expected": 1 },
      { "type": "statusCode", "expected": 503 }
    ],
    "tags": ["idempotency"]
  },
  {
    "name": "PublishBoard POST retries on 503 (naturally idempotent)",
    "description": "PublishBoard is a naturally idempotent POST and should be retried",
    "operation": "PublishBoard",
    "method": "POST",
    "path": "/{accountId}/boards/{boardId}/publication.json",
    "pathParams": { "accountId": "999", "boardId": 42 },
    "mockResponses": [
      {
        "status": 503,
        "headers": { "Content-Type": "application/json" },
        "body": { "error": "Service unavailable" }
      },
      {
        "status": 200,
        "headers": { "Content-Type": "application/json" },
        "body": null
      }
    ],
    "assertions": [
      { "type": "requestCount", "expected": 2 },
      { "type": "noError" }
    ],
    "tags": ["idempotency"]
  }
]
